<?xml version="1.0" encoding="UTF-8"?>
<alumnos xmlns:xsi="http://www.w3.org/2001/XMLSchema-instance"
         xsi:noNamespaceSchemaLocation="alumnos.xsd">

    <alumno num_alumno="a1" altura="178" sexo="H">
        <nombre>Juan Carlos</nombre>
        <apellidos>Del Carmen Benítez</apellidos>
        <domicilio>Calle Marismas Puntal de la Marina 27, Huelva</domicilio>
        <telefono tipo="propio">617012651</telefono>
        <telefono tipo="madre">600333444</telefono>
        <equipo>Baloncesto</equipo>
        <aficion>Videojuegos</aficion>
        <aficion>Programación</aficion>
        <origen>
            <provincia>Huelva</provincia>
        </origen>
        <comentarios>
            Alumno muy participativo.
        </comentarios>
        <notas>
            <evaluacion>1ª evaluación</evaluacion>
            <calificacion>8.5</calificacion>
            <evaluacion>2ª evaluación</evaluacion>
            <calificacion>9.0</calificacion>
        </notas>
    </alumno>

    <alumno num_alumno="a2" sexo="M" ayuda="a1">
        <nombre>Jacobo</nombre>
        <apellidos>Martín Salamanca</apellidos>
        <domicilio>Avenida Andalucía 25, Huelva</domicilio>
        <telefono tipo="padre">600555666</telefono>
        <aficion>Lectura</aficion>
        <aficion>Natación</aficion>
        <origen>
            <pais>España</pais>
        </origen>
        <comentarios/>
        <notas>
            <evaluacion>1ª evaluación</evaluacion>
            <calificacion>7.0</calificacion>
        </notas>
    </alumno>

</alumnos>
